original,eng,pol,ukr
LIVARNO home Loungeset Stahl/Seiloptik 4tlg. weiß (Packstück 2/2) ,LIVARNO home Loungeset Steel/Seiloptik 4 pieces white (pack 2/2),LIVARNO home loungeset stal/ linoptyka 4tlg. biały (pakiet 2/2),LIVARNO home Loungeset Styl/ loptic 4tlg. Білий (пам’ ячик 2/ 2)
Bissell »Crosswave« 3-in-1 Elektrischer Multiflächen-Bodenreiniger ,Bissell »Crosswave« 3-in-1 Electric multi-surface floor cleaner,Bisell  w Crosswave w 1 Czyszczący grunt elektryczny wielopowierzchniowy,"Bissell ""Croswave"" 3- in-1 електричний блок багатогранників"
"Bissell Hochleistungssauger »Featherweight Pro - Eco«, 2-in-1 ","Bissell high performance vacuum cleaner »Featherweight Pro - Eco«, 2-in-1","Odkurzacze o dużej wydajności  Węglowodane  Węglowe Pro - Eco., 2-in-1","Віч - на - еко, 2-й-й-й-й"
"Bissell Crosswave Pet Pro »2225N«, 3-in-1: saugen, wischen, trocknen ","Bissell Crosswave Pet Pro »2225N«, 3-in-1: suck, wipe, dry","Bissell Crosswave Pet Pro  w 2225N nie, 3-w-1: ssanie, wycieranie, suszenie","Bissell Croswave Pet '2225N', 3- в-1: ссок, витерти, висушити"
"Bissell Stielstaubsauger »MultiReach Essential«, kabellos, 18 V ","Bissell Stipular vacuum cleaner »MultiReach Essential«, wireless, 18 V","Odkurzacz do ugryzień  WieluReach Essential  Wietnam, bezprzewodowy, 18 V","Мульти - пилососососок « Мультта - реабат - есеїль », бездрот, 18 V"
Akkustaubsauger »CrossWave F 3« Pro Blac,Battery vacuum cleaner »CrossWave F 3« Pro Blac,Odkurzacz akumulatorowy  Wave F 3  w Pro Blac,"Окуляр акумулятора ""CrossWave F 3"" про Blac"
"Anker Powerbank, mit 3 Anschlüssen, schwarz ","Anchor Powerbank, with 3 connectors, black","Kotwica Powerbank, z 3 połączeniami, czarny","Якір заряду, з 3 вказівками, чорний"
HP Smart Tank »5106« All in One Multifunktionsdrucker ,HP Smart Tank »5106« All in One Multifunction Printer,HP Smart Tank  Wszystek w One Wielofunkcyjne Drukarki,"HP Smart Tinter ""5106"" ""Все в багатофункціональному принтері"
"VIAJERO Chardonnay-Viognier Reserva Privada Valle Central trocken vegan, Weißwein 2023","VIAJERO Chardonnay-Viognier Reserva Privada Valle Central dry vegan, white wine 2023","VIAJERO Chardonnay-Viognier Reserva Privada Valle Central suchy wegan, białe wino 2023","VIAJERO Chardonney Vygunni Reserva Privda Vale Centeral суху веган, білий вино 2023"
"Cepa Lebrel Rioja Crianza DOCa trocken, Rotwein 2019","Cepa Lebrel Rioja Crianza DOCa dry, red wine 2019","Cepa Lebel Rioja Crianza DOCA suchy, czerwone wino 2019","Сепа Лебедель Ріоя Коріна Діка, червоне вино 2019 року."
"Chianti DOCG trocken Magnum, Rotwein 2023","Chianti DOCG dry Magnum, red wine 2023","Chianti DOCG suchy Magnum, czerwone wino 2023","Киантія DOCDE сухого магнуму, червоне вино 2023 року."
"SMOBY Supermarkt, mit Einkaufswagen und Kasse ","SMOBY supermarket, with shopping cart and checkout","SMOBY supermarket, z wózkiem i kasą","Бенкет SMOBY, з візками і каторгою."
"SMOBY Traktor »Farmer Max«, mit Anhänger",SMOBY Tractor »Farmer Max« with trailer,"SMOBY Ciągnik  Wózek Max Wózek, z przyczepą","SMOBY трактор ""Farmer Max"", з послідовниками"
"SMOBY 3-in-1 Dreirad »Baby Driver Plus«, Premium-Ausstattung ","SMOBY 3-in-1 tricycle »Baby Driver Plus«, premium equipment","SMOBY 3-in-1 rowerek trójkołowy  niemowlak Driver Plus niemowlęta, sprzęt premium","SMOBY 3- in- 1 ""дитина Driver Premium Premium"""
"SMOBY Rutsche »Life«, mit Wasseranschluss für Gartenschlauch ","SMOBY slide »Life«, with water connection for garden hose","Zjeżdżalnia SMOBY  w Life nieruchoma, z podłączeniem wody do węża ogrodowego","SMOBY ricke 'Life', з водяним застібком для садового шланга"
Tefal Heißluftfritteuse »Easy Fry Classic EY2018« ,Tefal Hot air fryer »Easy Fry Classic EY2018«,Tefal Gorące Powietrza Fritteseuse  niedaleko Easy Fry Classic EY2018.,Teburtleuse 'Easy Fry Classic EY2018'
"Safety 1st Holz-Hochstuhl »Toto«, mitwachsend, mit Tisch (Wood white) ","Safety 1st wooden high chair »Toto«, growing along, with table (Wood white)",Safety 1st Drewniane krzesełko  Wood White,"Setetty 1st дерев'яного крісла (« Toto »), зі зростанням, зі столом (Wood jan)"
"Safety 1st Verlängerung für Türschutzgitter » U - Pressure Fit Extension+«, Klemmbefestigung, 7 cm ","Safety 1st extension for door guard » U - Pressure Fit Extension+«, clamp mounting, 7 cm","Safety 1st Przedłużenie dla siatki ochronnej drzwi .U. - Pressure Fit Extension+.U., Mocowanie zacisku, 7 cm","Sebetty 1 - столове продовження захисних парканів ""У - Prestur Fet Extension+"", укріплення, 7 см"
Safety 1st Türschutzgitter »Quick Close+« ,Safety 1st door guard »Quick Close+«,"Safety 1st Siatka zabezpieczająca drzwi  Wiesz, Quick Close+ Wietnam","Secetty 1st швейна сітка ""Quck Close+"""
"bebeconfort Kinderwagen »Bonny«, ultrakompakt ","bebeconfort stroller »Bonny«, ultra compact","wózek dziecięcy bebeconfort                  Wózek dziecięcy Bonny      Wózek dziecięcy bebeconfort, ultrakompaktowy","Композитний дитячий візок (« Бонні »), максимуляція."
bebeconfort 2-in-1-Wippe »Timba Baby« ,bebeconfort 2-in-1 cover »Timba Baby«,bebeconfort 2-in-1-Wippe  w Timba Baby,"""Дитино Тімба"""
vtech Schlummer-Faultier »Schnarchi« ,vtech slumber sloth »Schnarchi«,Vtech Smer-Faultier  niedźwiedź,"""Scharchi"" vertech Schillmer"
"Malbec Pays d'Oc Les Terrasses IGP trocken, Rotwein 2018 ","Malbec Pays d'Oc Les Terrasses IGP dry, red wine 2018","Malbec Pays d'Oc Les Tarasy IGP suche, czerwone wino 2018","Малбек Пайс d’Oc Les Baraders сухо, червоне вино 2018 р."
Plantation Rum Barbados XO Extra Old 20th Anniversary mit Geschenkbox 40% Vol ,Plantation Rum Barbados XO Extra Old 20th Anniversary with gift box 40% Vol,Plantation Rum Barbados XO Extra Old 20th Anniversary z pudełkiem upominkowym 40% Vol,Планування Руму Барбадоса XO розширений Старий 20-й анверстери з подарунком 40% Воль
"Monalie Côtes de Provence rosé AOP trocken, Roséwein 2020 ","Monalie Côtes de Provence rosé AOP dry, rosé wine 2020","Monalie Côtes de Provence rosé AOP suche, wino różowe 2020","Моналі - Коутес - де - Прованс roé AOP сухо, поршей 2020"
"LACOSTE Herren Boxer, 3 Stück, bequeme Stretch-Baumwolle (schwarz, M) ","LACOSTE Men's Boxer, 3 pieces, comfortable stretch cotton (black, M)","Mężczyźni LACOSTE, 3 sztuki, wygodne tkaniny stretch (czarny, M)","LACOSTE Господа боксера, 3 шматки, зручний вовняний інструмент (чорний, M)"
Boxing Crepe Bandage,Boxing Crepe Bandage,Boxing Crepe Bandage,Боксінг Crepe Getage
"ERFURT Rauhfasertapeten »Classico«, 6 Rollen ","FURTHER Rough fibre wallpaper »Classico«, 6 rolls","ERFURT Tapety z włókna gąsienicowego, 6 rolki","ERFURT Rauhowtapete 'Classico', 6 ролей"
"ERFURT Vlies-Rauhfasertapeten »Classico«, 6 Rollen ","ERFURT non-woven wallpaper »Classico«, 6 rolls",ERFURT WŁÓKNA WŁÓKIENNICZE Tapety WŁÓKIENNICZE,"ERFURT Vuba plexico, 6 ролей"
Erfurt Starter Box Vlies-Rauhfaser »Viva« ,Erfurt Starter Box Non-Woven Raw Fiber »Viva«,Erfurt Starter Box Vlies-RauhWłókno  Włókno Włókniane  Włókno Włókno Włókniane,Захоплює поле Vvia волокнистого волокнистого волокнистого « Vava ».
