original,eng,pol,ukr
LIVARNO home Loungeset Stahl/Seiloptik 4tlg. weiß (Packstück 2/2) ,LIVARNO home Loungeset Steel/Seiloptik 4 pieces white (pack 2/2),Dom LIVARNO Loungeset Stale/Seiloptik 4 białe kuście (pakowanie 2/2),ЛІВАРНО дом Лунжесет сталь/Селоптик 4 білі частинки (пакет 2/2)
Bissell »Crosswave« 3-in-1 Elektrischer Multiflächen-Bodenreiniger ,Bissell »Crosswave« 3-in-1 Electric multi-surface floor cleaner,Bissell »Crossfal« 3-in-1 Elektryczne czyszczenie podłogi,Бішел »Кросвіль« 3-ін-1 Електричний чистач поверхній підлоги
"Bissell Hochleistungssauger »Featherweight Pro - Eco«, 2-in-1 ","Bissell high performance vacuum cleaner »Featherweight Pro - Eco«, 2-in-1","Bissell wysokie czyszczenie wydajności »Featherweg Pro - Eco«, 2-in-1","Бішел високий випробовий чистеч »Феатервег Pro - Eco«, 2- ін-1"
"Bissell Crosswave Pet Pro »2225N«, 3-in-1: saugen, wischen, trocknen ","Bissell Crosswave Pet Pro »2225N«, 3-in-1: suck, wipe, dry","Bissell Crosswl Pet Pro »2225N«, 3-in-1: śmierci, śmierci, suchy","Бішел Піт про »2225N«, 3- ін-1: смучка, обриває, суха"
"Bissell Stielstaubsauger »MultiReach Essential«, kabellos, 18 V ","Bissell Stipular vacuum cleaner »MultiReach Essential«, wireless, 18 V","Bissell Stipular czyszczenie »MultiReach Essential«, bezprzednik, 18 V","Біселл Стипулярний викусник » Мількогорячне значення «, безбедний, 18 V"
Akkustaubsauger »CrossWave F 3« Pro Blac,Battery vacuum cleaner »CrossWave F 3« Pro Blac,Clearing bateria »CrossWave F 3« Pro Blac,Чистити батарею »CrossWave F 3« Pro Blac
"Anker Powerbank, mit 3 Anschlüssen, schwarz ","Anchor Powerbank, with 3 connectors, black","Anchor Powerbank, z 3 połączników, czarny","Анхорний поверхний банк, з 3 з’ єднаннями, чорними"
HP Smart Tank »5106« All in One Multifunktionsdrucker ,HP Smart Tank »5106« All in One Multifunction Printer,HP Smart Tank »5106« Wszystkie w jednym drukarze wielofunkcyjnym,HP Smart Tank »5106« Всі в одному багатофункційному принтері
"VIAJERO Chardonnay-Viognier Reserva Privada Valle Central trocken vegan, Weißwein 2023","VIAJERO Chardonnay-Viognier Reserva Privada Valle Central dry vegan, white wine 2023","VIAJERO Chardonnay-Viognier Reserva Privada Valle Centralny suchy vegan, białe wino 2023","ВІАЙЕРО Чардоннай-Віогніер Резерва Привада Вале Центрально сухий веганський, білий вино 2023"
"Cepa Lebrel Rioja Crianza DOCa trocken, Rotwein 2019","Cepa Lebrel Rioja Crianza DOCa dry, red wine 2019","Cepa Lebrel Rioja Crianza DOCA sucha, czerwona wina 2019","Цепа Лебрел Ріоча Крианза ДОКА сухий, червоний вино 2019"
"Chianti DOCG trocken Magnum, Rotwein 2023","Chianti DOCG dry Magnum, red wine 2023","Chianti DOCG suchy Magnum, czerwony wino 2023","Чіанти DOCG сухий Магном, червоний вино 2023"
"SMOBY Supermarkt, mit Einkaufswagen und Kasse ","SMOBY supermarket, with shopping cart and checkout","SMOBY supermarket, z koszyką zakupy i checkout","СМОБІЙський супермаркет, з купувальними кошарками і використанням"
"SMOBY Traktor »Farmer Max«, mit Anhänger",SMOBY Tractor »Farmer Max« with trailer,SMOBY Tractor »Farmer Max« z przybliżeniem,СМОБІ Трактор » Фармер Макс« з притрудником
"SMOBY 3-in-1 Dreirad »Baby Driver Plus«, Premium-Ausstattung ","SMOBY 3-in-1 tricycle »Baby Driver Plus«, premium equipment","SMOBY 3-in-1 trzycykł »Baby Driver Plus«, urządzenie premium","СМОБY 3- ін-1- трицикл »Бабі драйвер Плюс«, примійне пристройство"
"SMOBY Rutsche »Life«, mit Wasseranschluss für Gartenschlauch ","SMOBY slide »Life«, with water connection for garden hose","SMOBY Slide »Life«, z połączeniem wody dla żołki w ogrodzie","СМОБІ Слайд »Живот«, з водним з’єднанням для слухів саду"
Tefal Heißluftfritteuse »Easy Fry Classic EY2018« ,Tefal Hot air fryer »Easy Fry Classic EY2018«,Tefal Got powietrz »Easy Fry Classic EY2018«,Тефальний гортний повітряч »Лішкий класський EY2018«
"Safety 1st Holz-Hochstuhl »Toto«, mitwachsend, mit Tisch (Wood white) ","Safety 1st wooden high chair »Toto«, growing along, with table (Wood white)","Bezpieczeństwo 1 drzewowym wysokim stołem »Toto«, rosny wspólnot z stołą (Wood białą)","Перший деревий високий кісла »Toto«, розвиваючись разом з столом (білою білою)"
"Safety 1st Verlängerung für Türschutzgitter » U - Pressure Fit Extension+«, Klemmbefestigung, 7 cm ","Safety 1st extension for door guard » U - Pressure Fit Extension+«, clamp mounting, 7 cm","Bezpieczeństwo 1 rozszerzenie dla ochrony drzwi » U - Ciśnienie Fit Extension+«, montacja klubka, 7 cm","Перший розширення безпеки для охоронячі дверей » U - Tick Fit Extension+«, монтаження клямп, 7 см"
Safety 1st Türschutzgitter »Quick Close+« ,Safety 1st door guard »Quick Close+«,Bezpieczeństwo Pierwszego ochrona drzwi » Quick Zamknij+«,Перший охоронник безпеки » Швидко закрити +«
"bebeconfort Kinderwagen »Bonny«, ultrakompakt ","bebeconfort stroller »Bonny«, ultra compact","bebeconfort watcher »Bonny«, ultra kompakt","ванкер « Бонні », ультра компакт"
bebeconfort 2-in-1-Wippe »Timba Baby« ,bebeconfort 2-in-1 cover »Timba Baby«,bebeconfort 2-in-1 pokrytek »Timba Baby«,bebeconfort 2- ін-1 покрива »Тимба дитина«
vtech Schlummer-Faultier »Schnarchi« ,vtech slumber sloth »Schnarchi«,vtech snow sloth »Schnarchi«,vtech sloth sloth »Schnarchi«
"Malbec Pays d'Oc Les Terrasses IGP trocken, Rotwein 2018 ","Malbec Pays d'Oc Les Terrasses IGP dry, red wine 2018","Malbec Pay d'Oc Les Terrasses IGP suchy, czerwony wino 2018","Мальбек Плає д'Ок Les Terrasses IGP сухий, червоний вино 2018"
Plantation Rum Barbados XO Extra Old 20th Anniversary mit Geschenkbox 40% Vol ,Plantation Rum Barbados XO Extra Old 20th Anniversary with gift box 40% Vol,Plantacja Rum Barbados XO Ekstra stara 20-godzina z postaciem danego 40% vol,Плантація Рум Барбадос XO Додаткові 20-го годинниці з подарункою 40% вол
"Monalie Côteger Provence rosé AOP trocken, Roséwein 2020 ","Monalie Côteger Provence rosé AOP dry, rosé wine 2020","Monalie Côteger Provence Rosé AOP suchy, rosé vin 2020","Моналі Котгер Провенс Росе АОП, росе вино 2020"
"LACOSTE Herren Boxer, 3 Stück, bequeme Stretch-Baumwolle (schwarz, M) ","LACOSTE Men's Boxer, 3 pieces, comfortable stretch cotton (black, M)","LACOSTE Mężczyzn Boxer, 3 kluczowe, odpowiednie bawełny (czarny, M)","Боксер ЛАКОСТТІ, 3 частинки, комфортний бавуль ( чорний, М)"
Boxing Crepe Bandage,Boxing Crepe Bandage,Bandaż krepy Boxing,Бандаж кріпів Boxing
"ERFURT Rauhfasertapeten »Classico«, 6 Rollen ","FURTHER Rough fibre wallpaper »Classico«, 6 rolls","INNIEJSZE tapety własne »Classico«, 6 rolls","ЩЕРІЙ тапет грубих фіксів »Classico«, 6 рольів"
"ERFURT Vlies-Rauhfasertapeten »Classico«, 6 Rollen ","ERFURT non-woven wallpaper »Classico«, 6 rolls","ERFURT tapeta niewłaśnie »Classico«, 6 rolls","Тапет ERFURT, яка не викривається »Classico«, 6 рольів"
Erfurt Starter Box Vlies-Rauhfaser »Viva« ,Erfurt Starter Box Non-Woven Raw Fiber »Viva«,Erfurt Starter Box Nie-Woven Fiber Raw »Viva«,Ерфурт Стартейнер- скринька не- вікна Ровна фібера »Віва«
